{
  "schema_version": 2,
  "run_id": "a1b2c3d4-e5f6-7890-abcd-ef1234567890",
  "page_id": "function+core+calc",
  "required_checks": [
    {
      "id": "identity",
      "rule_id": "identity",
      "subject": "core.calc()",
      "source": "object_type",
      "applicable": true,
      "blocking": true
    },
    {
      "id": "sql_registry",
      "rule_id": "sql_registry",
      "subject": "core.calc()",
      "source": "object_type",
      "applicable": true,
      "blocking": true
    },
    {
      "id": "registry_document",
      "rule_id": "registry_document",
      "subject": "core.calc()",
      "source": "object_type",
      "applicable": true,
      "blocking": true
    },
    {
      "id": "operation:select:1",
      "rule_id": "operation",
      "subject": "core.calc()/SELECT/1",
      "source": "inventory",
      "inventory_anchor": {
        "path": "source.sql",
        "object_or_scope": "core.calc()",
        "construct": "SELECT",
        "ordinal": 1
      },
      "applicable": true,
      "blocking": true
    }
  ]
}
